,_id,candidate_ratio,canditate_ratio,days_after,debate,newspaper,stemmed,text,title,violent_ratio,violent_words,word_count,year
0,245,0.10351201478743069,0.10536044362292052,1,1,The New York Post,"['america', 'futur', 'debat', 'mitt', 'knockout', 'pound', 'prez', 'weak', 'economi', 'score', 'big', 'hit', 'taxcut', 'plan', 'land', 'counterpunch', 'medicar', 'denver', 'invigor', 'mitt', 'romney', 'brought', 'game', 'last', 'night', 'presidenti', 'debat', 'fierc', 'fight', 'back', 'presid', 'obama', 'attack', 'romney', 'trickl', 'tax', 'plan', 'hit', 'obama', 'nation', 'econom', 'troubl', 'much', 'debat', 'obama', 'sit', 'lead', 'poll', 'didnt', 'take', 'fight', 'romney', 'sharpest', 'attack', 'fail', 'rais', 'romney', 'percent', '\xadremark', 'bring', 'romney', 'time', 'bain', 'capit', 'romney', 'whose', 'advis', 'promis', 'turnaround', 'campaign', 'debat', 'said', 'tax', 'would', 'take', 'differ', 'path', 'one', 'one', 'presid', 'describ', 'topdown', 'cut', 'tax', 'rich', 'candid', 'spar', 'minut', 'topic', 'tax', 'obama', 'slam', 'romney', 'tax', 'plan', 'trillion', 'budget', 'buster', 'romney', 'defend', 'tax', 'plan', 'vow', 'add', 'deficit', 'tax', 'plan', 'doddfrank', 'bank', 'regul', 'romney', 'slam', 'bank', 'law', 'overreach', 'call', 'biggest', 'kiss', 'given', 'new', 'york', 'bank', 'ive', 'ever', 'seen', 'vow', 'repeal', 'replac', 'energi', 'romney', 'insist', 'like', 'green', 'energi', 'tune', 'billion', 'subsidi', 'obama', 'hand', 'obamacar', 'romney', 'continu', 'vow', 'first', 'day', 'offic', 'would', 'elimin', 'presid', 'healthcar', 'overhaul', 'obama', 'counter', 'romney', 'show', 'card', 'replac', 'medicar', 'obama', 'attack', 'romney', 'plan', 'turn', 'medicar', 'voucher', 'romney', 'hit', 'back', 'accus', 'obama', 'take', 'billion', 'medicar', 'pay', 'obamacar', 'tax', 'centerpiec', 'campaign', 'domin', 'earli', 'action', 'obama', 'attack', 'romney', 'plan', 'lower', 'tax', 'rate', 'almost', 'incom', 'group', 'say', 'go', 'pay', 'close', 'loophol', 'deduct', 'presid', 'said', 'problem', 'ask', 'hundr', 'time', 'would', 'close', 'deduct', 'loophol', 'abl', 'identifi', 'romney', 'shot', 'back', 'trillion', 'tax', 'cut', 'tax', 'cut', 'scale', 'talk', 'add', 'deficit', 'tax', 'plan', 'vow', 'obama', 'said', 'possibl', 'find', 'enough', 'deduct', 'without', 'either', 'rais', 'deficit', 'hit', 'middl', 'class', 'math', 'arithmet', 'obama', 'said', 'point', 'american', 'peopl', 'ask', 'reason', 'governor', 'romney', 'keep', 'plan', 'secret', 'good', 'presid', 'quip', 'nonpartisan', 'tax', 'polici', 'center', 'conclud', 'percent', 'acrosstheboard', 'tax', 'cut', 'like', 'romney', 'offer', 'would', 'cost', 'trillion', 'year', 'romney', 'said', 'put', 'kind', 'govern', 'program', 'chop', 'block', 'obamacar', 'list', 'apolog', 'presid', 'use', 'term', '\xadrespect', 'like', 'obama', 'respond', 'good', 'get', 'rid', 'said', '\xadromney', 'romney', 'perform', 'well', 'sever', 'republicanprimari', 'debat', 'critic', 'stiff', 'campaign', 'trail', 'even', 'score', 'point', 'obama', 'congratul', 'wife', 'michell', 'wed', 'anniversari', 'twenti', 'year', 'ago', 'becam', 'luckiest', 'man', 'earth', 'michell', 'obama', 'agre', 'marri', 'presid', 'said', 'top', 'debat', 'congratul', 'presid', 'anniversari', 'romney', 'said', 'sure', 'romant', 'place', 'could', 'imagin', 'debat', 'romney', 'seem', 'energet', 'turn', 'often', 'look', 'toward', 'obama', 'presid', 'speak', 'often', 'look', 'toward', '\xadpodium', 'away', 'romney', 'time', 'romney', 'cut', 'moder', 'jim', 'lehrer', 'talk', 'time', 'limit', 'someth', 'obama', 'also', 'get', 'chide', 'time', 'lehrer', 'obama', 'describ', 'romney', 'tax', 'plan', 'keep', 'place', 'bushera', 'tax', 'cut', 'trickl', 'romney', 'describ', 'robin', 'hood', 'ought', 'provid', 'tax', 'relief', 'peopl', 'middl', 'class', 'go', 'reduc', 'share', 'tax', 'paid', 'highincom', 'peopl', 'highincom', 'peopl', 'fine', 'economi', 'romney', 'explain', 'peopl', 'hard', 'time', 'right', 'middleincom', 'american', 'presid', 'polici', 'middleincom', 'american', 'buri', 'ad', 'quot', 'line', 'vice', 'presid', 'joe', 'biden', 'utter', 'tuesday', 'campaigntrail', 'gaff', 'romney', 'describ', 'obama', 'philosophi', 'trickledown', 'govern', 'call', 'sluggish', 'economi', 'economi', 'tax', 'nation', 'twice', 'obama', 'invok', 'bill', 'clinton', 'lifelin', 'bill', 'clinton', 'tri', 'econom', 'approach', 'talk', 'creat', 'million', 'new', 'job', 'went', 'deficit', 'surplus', 'said', 'one', 'point', 'romney', 'even', 'mention', 'may', 'need', 'get', 'new', 'account', 'obama', 'interject', 'anyth', 'percent', 'tax', 'rate', 'romney', 'made', 'million', 'incom', 'last', 'year', 'debat', 'move', 'onto', 'anoth', 'section', 'obama', 'grew', 'focus', 'debat', 'wore', 'romney', 'said', 'replac', 'obamacar', 'bank', 'regul', 'polici', 'obama', 'hit', 'hide', 'ball', 'governor', 'romney', 'say', 'replac', 'obamacar', 'go', 'repeal', 'replac', 'someth', 'said', 'obama', 'problem', 'describ', 'exact', 'replac', 'say', 'go', 'leav', 'state', 'presid', 'either', 'prepar', 'meander', 'said', 'romney', 'senior', 'advis', 'ron', 'kaufman', 'afterward', 'stutter', 'whole', 'bunch', 'almost', 'like', 'know', 'want', 'geoffearl', 'nypostcom']","﻿
America's Future No debating it: Mitt knockout l  Pounds prez on weak US economy
l  Scores big hit with his tax-cut plan l  Lands counterpunch on Medicare
DENVER - An invigorated Mitt Romney brought his A game to last night's
presidential debate, fiercely fighting back against President Obama's attacks on
Romney's ""trickle down"" tax plan and hitting Obama for the nation's economic
troubles.
For much of the debate, Obama, who was sitting on a lead in the polls, didn't
take the fight to Romney with his sharpest attacks - failing to raise Romney's
"" percent"" ­remarks or bring up Romney's time at Bain Capital.
Romney, whose advisers have been promising a turnaround for his campaign after
the debate, said that on taxes he would ""take a different path - not the one
we've been on, not the one the president describes as a top-down, cut taxes for
the rich.""
The candidates sparred for  minutes on topics such as:
n Taxes: Obama slammed Romney's tax plan as a $ trillion budget buster. Romney
defended his tax plan, vowing, ""I will not add to the deficit with my tax plan.""
n Dodd-Frank banking regulations: Romney slammed the banking law as an
overreach, calling it ""the biggest kiss that's been given to New York banks I've
ever seen. He vowed to repeal and replace it.
n Energy: Romney insisted that he, too, likes green energy - just not to the
tune of $ billion in subsidies that Obama has handed out.
n ObamaCare: Romney continued to vow that on his first day in office he would
eliminate the president's health-care overhaul, while Obama countered that
Romney won't show his cards on how to replace it.
n Medicare: Obama attacked Romney's plan to turn Medicare into a ""voucher.""
Romney hit back, accusing Obama of taking ""$ billion"" out of Medicare to pay
for ObamaCare.
But taxes, the centerpiece of both campaigns, dominated the early action, with
Obama attacking Romney's plan to lower tax rates for almost all income groups.
""And he is saying that he is going to pay for it by closing loopholes and
deductions,"" the president said. ""The problem is that he's been asked over a
hundred times how you would close those deductions and loopholes; he hasn't been
able to identify them.""
But Romney shot back: ""I don't have a $ trillion tax cut. I don't have a tax
cut of the scale that you're talking about.
""I will not add to the deficit with my tax plan,"" he vowed.
Obama said it was ""not possible"" to find enough deductions without either
raising the deficit or hitting the middle class. ""It's math. It's arithmetic,""
Obama said.
""At some point, the American people have to ask themselves if the reason that
Governor Romney is keeping all these plans secret is because they're too good,""
the president quipped.
The nonpartisan Tax Policy Center concluded that a  percent across-the-board
tax cut like Romney is offering would cost $ trillion over  years.
Romney said he'd put all kinds of government programs on the chopping block.
""ObamaCare is on my list. I apologize, Mr. President. I use that term with all
­respect.""
""I like it,"" Obama responded.
""OK, good. So I'd get rid of that,"" said ­Romney.
Romney, who performed well in several Republican-primary debates but has been
criticized for being stiff on the campaign trail, even scored a point after
Obama congratulated his wife, Michelle, on their th wedding anniversary.
""Twenty years ago I became the luckiest man on earth because Michelle Obama
agreed to marry me,"" the president said at the top of the debate.
""Congratulations to you, Mr. President, on your anniversary,"" Romney said. ""I'm
sure this was the most romantic place you could imagine here - here with me.""
During the debate Romney seemed more energetic, turning more often to look
toward Obama. The president when he wasn't speaking often looked down toward the
­podium or away from Romney.
At times Romney cut off moderator Jim Lehrer and talked over his time limit -
something Obama also did, getting chided at times by Lehrer.
After Obama described Romney's tax plan to keep in place Bush-era tax cuts as
""trickle down,"" Romney described them more as Robin Hood.
""We ought to provide tax relief to people in the middle class. But I'm not going
to reduce the share of taxes paid by high-income people. High-income people are
doing just fine in this economy. ,"" Romney explained.
""The people who are having the hard time right now are middle-income Americans.
Under the president's policies, middle-income Americans have been buried,"" he
added - quoting a line that Vice President Joe Biden uttered Tuesday in a
campaign-trail gaffe.
Romney described Obama's philosophy as ""trickle-down government,"" and called the
sluggish economy an ""economy tax"" on the nation.
Twice Obama invoked Bill Clinton as a lifeline. ""Bill Clinton tried the
[economic] approach that I'm talking about. We created  million new jobs. We
went from deficit to surplus,"" he said.
At one point Romney even mentioned how he may need ""to get a new accountant"" -
and Obama didn't interject anything about the  percent tax rate Romney made on
millions in income last year as the debate moved onto another section.
Obama grew more focused as the debate wore on. After Romney said he'd replace
ObamaCare, banking regulations and other policies, Obama again hit him for
hiding the ball.
""Governor Romney says 'We should replace [ObamaCare], I'm just going to repeal
it, but - but we can replace it with something,' "" said Obama. ""But the problem
is, he hasn't described what exactly we'd replace it with, other than saying
we're going to leave it to the states.""
""The president was either not prepared or meandered,"" said Romney senior adviser
Ron Kaufman afterward.
""He stuttered a whole bunch. It's almost like he didn't know where he wanted to
go.""
geoff.earle@nypost.com
",America's Future No debating it: Mitt knockout l  Pounds prez on weak US economy l  Scores big hit with his tax-cut plan l  Lands counterpunch on Medicare,0.03512014787430684,"['hit', 'fight', 'attack', 'hit', 'fight', 'attack', 'cut', 'defend', 'attack', 'hit', 'attack', 'cut', 'cut', 'hit', 'cut', 'chop', 'cut', 'cut', 'hit']",952,2012
1,247,0.07407407407407407,0.07583774250440917,1,1,The Christian Science Monitor,"['presidenti', 'debat', 'mitt', 'romney', 'inject', 'new', 'life', 'campaign', 'obit', 'campaign', 'written', 'mitt', 'romney', 'defi', 'expect', 'turn', 'lifetim', 'perform', 'first', 'presidenti', 'debat', 'rival', 'barack', 'obama', 'sudden', 'new', 'race', 'final', 'month', 'presidenti', 'race', 'got', 'interest', 'turn', 'stronger', 'debat', 'perform', 'presid', 'obama', 'instant', 'postgam', 'consensus', 'republican', 'democrat', 'voter', 'gop', 'nomine', 'mitt', 'romney', 'inject', 'new', 'life', 'campaign', 'near', 'given', 'dead', 'despit', 'slim', 'deficit', 'poll', 'new', 'poll', 'consid', 'cnnorc', 'survey', 'american', 'watch', 'debat', 'taken', 'immedi', 'conclus', 'found', 'percent', 'said', 'romney', 'perform', 'better', 'versus', 'percent', 'obama', 'likelihood', 'obama', 'reelect', 'measur', 'onlin', 'bet', 'market', 'intrad', 'plung', 'percent', 'debat', 'percent', 'thursday', 'morn', 'even', 'obama', 'strongest', 'support', 'brutal', 'assess', 'even', 'debat', 'end', 'believ', 'say', 'obama', 'look', 'like', 'need', 'teleprompt', 'tweet', 'comedian', 'bill', 'maher', 'donat', 'million', 'biggest', 'proobama', 'super', 'politicalact', 'committe', 'immedi', 'debat', 'obama', 'spokespeopl', 'appear', 'subdu', 'interview', 'morn', 'campaign', 'back', 'offens', 'accus', 'romney', 'lie', 'throughout', 'debat', 'dust', 'settl', 'romney', 'dozen', 'flatout', 'falsehood', 'thing', 'remain', 'debat', 'perform', 'avoid', 'truth', 'definit', 'romney', 'candidaci', 'escap', 'singl', 'smooth', 'appear', 'obama', 'campaign', 'said', 'introduct', 'videotap', 'replay', 'alleg', 'lie', 'romney', 'campaign', 'part', 'releas', 'new', 'thursday', 'morn', 'pound', 'home', 'central', 'messag', 'debat', 'perform', 'job', 'creation', 'polici', 'includ', 'tax', 'reform', 'expand', 'trade', 'crack', 'china', 'creat', 'million', 'new', 'job', 'get', 'countri', 'back', 'track', 'romney', 'campaign', 'said', 'statement', 'romney', 'came', 'denver', 'debat', 'stage', 'prepar', 'perhap', 'even', 'bit', 'overprepar', 'talk', 'point', 'view', 'obama', 'plan', 'would', 'hit', 'wealthi', 'also', 'small', 'busi', 'engin', 'econom', 'growth', 'debat', 'romney', 'tore', 'ream', 'statist', 'jobcreat', 'concern', 'voter', 'amid', 'straight', 'month', 'unemploy', 'percent', 'fiftyfour', 'percent', 'america', 'worker', 'work', 'busi', 'tax', 'corpor', 'tax', 'rate', 'individu', 'tax', 'rate', 'lower', 'rate', 'abl', 'hire', 'peopl', 'romney', 'said', 'look', 'ever', 'polish', 'businessman', 'year', 'job', 'conclud', 'obama', 'respond', 'accus', 'romney', 'say', 'never', 'mind', 'tax', 'plan', 'threaten', 'harm', 'middl', 'class', 'elimin', 'tax', 'deduct', 'program', 'make', 'sure', 'everybodi', 'get', 'fair', 'shot', 'romney', 'approach', 'grow', 'economi', 'way', 'pay', 'without', 'either', 'burden', 'middl', 'class', 'blow', 'deficit', 'make', 'drastic', 'cut', 'thing', 'like', 'educ', 'obama', 'said', 'romney', 'fought', 'back', 'hard', 'beat', 'back', 'moder', 'jim', 'lehrer', 'attempt', 'enforc', 'debat', 'schedul', 'time', 'limit', 'accus', 'obama', 'plan', 'rais', 'tax', 'success', 'small', 'busi', 'percent', 'percent', 'cost', 'job', 'want', 'cost', 'job', 'said', 'prioriti', 'job', 'republican', 'thrill', 'romney', 'perform', 'liken', 'takedown', 'former', 'hous', 'speaker', 'newt', 'gingrich', 'critic', 'point', 'republican', 'primari', 'democrat', 'affili', 'obama', 'campaign', 'tough', 'presid', 'mani', 'observ', 'opin', 'obama', 'seem', 'eager', 'debat', 'stage', 'wednesday', 'night', 'think', 'game', 'tonight', 'said', 'jame', 'carvill', 'mastermind', 'presid', 'clinton', 'first', 'elect', 'cnn', 'debat', 'democrat', 'stun', 'obama', 'made', 'refer', 'damag', 'videotap', 'romney', 'privat', 'fundrais', 'dismiss', 'percent', 'american', 'pay', 'feder', 'incom', 'tax', 'romney', 'record', 'bain', 'capit', 'includ', 'layoff', 'one', 'count', 'obama', 'near', 'five', 'week', 'three', 'debat', 'two', 'presidenti', 'one', 'vicepresidenti', 'nov', 'elect', 'obama', 'fact', 'histori', 'up', 'down', 'polit', 'perform', 'histori', 'come', 'back', 'get', 'knock', 'romney', 'histori', 'get', 'knock', 'reviv', 'back', 'wall', 'inde', 'romney', 'well', 'wednesday', 'debat', 'halfwritten', 'obituari', 'campaign', 'would', 'like', 'complet', 'perhap', 'romney', 'biggest', 'regret', 'debat', 'start', 'late', 'campaign', 'earli', 'vote', 'alreadi', 'start', 'state', 'includ', 'ohio', 'arguabl', 'crucial', 'battleground', 'countri', 'open', 'poll', 'tuesday', 'republican', 'ever', 'won', 'presid', 'without', 'win', 'ohio', 'bad', 'voter', 'see', 'romney', 'sooner', 'say', 'republican', 'strategist', 'ford', 'oconnel', 'suggest', 'former', 'governor', 'show', 'glimps', 'reason', 'practic', 'massachusett', 'moder', 'democrat', 'fear', 'person', 'wors', 'night', 'presid', 'obama', 'sesam', 'street', 'big', 'bird', 'debat', 'ask', 'feder', 'spend', 'would', 'cut', 'romney', 'target', 'public', 'broadcast', 'servic', 'home', 'children', 'show', 'sesam', 'street', 'express', 'love', 'show', 'larg', 'featheri', 'central', 'charact', 'follow', 'nod', 'debat', 'moder', 'lehrer', 'pbss', 'newshour', 'anoth', 'icon', 'public', 'actual', 'like', 'romney', 'said', 'quip', 'seem', 'prepackag', 'matter', 'light', 'moment', 'fair', 'dri', 'debat', 'candid', 'struggl', 'likabl', 'one', 'mani', 'reason', 'republican', 'spring', 'step', 'thursday', 'morn']","﻿
Presidential debate: Mitt Romney injects new life in his campaign;
With the obits of his campaign all but written, Mitt Romney defies expectations
and turns in a lifetime performance in the first presidential debate with rival
Barack Obama. Suddenly, it's a new race.
The final month of the  presidential race just got more interesting.
By turning in a stronger debate performance than President Obama - the instant
post-game consensus of Republicans, Democrats, and voters themselves - GOP
nominee Mitt Romney has injected new life into a campaign that had nearly been
given up for dead, despite only a slim deficit in polls.
Here's a new poll to consider: A CNN/ORC survey of  Americans who had watched
the debate, taken immediately after its conclusion, found that  percent said
Mr. Romney performed better, versus only  percent for Mr. Obama. The
likelihood of Obama's reelection, as measured by the online betting market
Intrade, plunged from  percent before the debate to  percent Thursday
morning.
Even some of Obama's strongest supporters were brutal in their assessments, even
before the debate had ended.
""I can't believe I'm saying this, but Obama looks like he DOES need a
teleprompter,"" tweeted comedian Bill Maher, who has donated $ million to the
biggest pro-Obama ""super political-action committee.""
Immediately after the debate, Obama spokespeople appeared subdued in TV
interviews. But by the morning after, the campaign was back on offense, accusing
Romney of lying throughout the debate.
""When the dust settles, Romney's dozen flat-out falsehoods will be the only
thing remaining from his debate performance - because avoiding the truth has
been the very definition of Romney's candidacy, and he can't escape that with a
single smooth appearance,"" the Obama campaign said in an introduction to a
videotape replaying the alleged lies.
The Romney campaign, for its part, released a new TV ad Thursday morning
pounding home the central message of his debate performance: That he is all
about job creation.
""Through his policies including tax reform, expanding trade and cracking down on
China, he'll create over  million new jobs and get our country back on track,""
the Romney campaign said in its statement about the ad.
Romney came to the Denver debate stage prepared, perhaps even a bit
over-prepared, with talking points about his view of Mr. Obama's plan for the
that would hit not just the wealthy, but also the small businesses that are the
engine of economic growth.
During the debate, Romney tore through reams of statistics about job-creation,
the No.  concern of voters amid  straight months of unemployment over 
percent.
""Fifty-four percent of America's workers work in businesses that are taxed not
at the corporate tax rate but at the individual tax rate. And if we lower that
rate, they will be able to hire more people,"" Romney said, looking ever the
polished businessman he was for  years.
""For me, this is about jobs,"" he concluded.
Obama responded by accusing Romney of saying ""never mind"" to his tax plan, and
threatening to harm the middle class by eliminating tax deductions and programs
that make sure ""everybody's getting a fair shot.""
Romney's approach ""will not grow our economy because the only way to pay for it
without either burdening the middle class or blowing up our deficit is to make
drastic cuts in things like education,"" Obama said.
Romney fought back hard, beating back moderator Jim Lehrer's attempts to enforce
the debate schedule's time limits. He accused Obama of planning to raise taxes
on ""successful small businesses from  percent to  percent"" at a cost of
, jobs.
""I don't want to cost jobs,"" he said. ""My priority is jobs.""
Not only were Republicans thrilled with Romney's performance - likening it to
his take-down of former House Speaker Newt Gingrich at a critical point in the
Republican primaries - Democrats not affiliated with Obama's campaign were tough
on the president. Many observers opined that Obama didn't seem all that eager to
be on the debate stage Wednesday night.
""I think he was off his game tonight,"" said James Carville, the mastermind of
President Clinton's first election in , on CNN after the debate.
Democrats were stunned that Obama made no reference to the damaging videotape of
Romney at a private fundraiser dismissing the  percent of Americans who pay no
federal income tax, or to Romney's record at Bain Capital, including layoffs.
But no one is counting Obama out. There are nearly five weeks and three more
debates to go - two presidential and one vice-presidential - before the Nov. 
election. Obama, in fact, has a history of ups and downs as a political
performer, and a history of coming back when he gets knocked down.
Romney, too, has a history of getting knocked down, then reviving when his back
is against the wall.
Indeed, Romney had to do well in Wednesday's debate, or the half-written
obituaries on his campaign would likely have been completed. Perhaps Romney's
biggest regret will be that the debates started so late in the campaign. Early
voting has already started in some states, including Ohio, arguably the most
crucial battleground in the country, which opened its polls on Tuesday. No
Republican has ever won the presidency without winning Ohio.
""It's too bad that voters didn't see this Romney sooner,"" says Republican
strategist Ford O'Connell, suggesting that the former governor showed glimpses
of the ""reasonable, practical"" Massachusetts moderate whom Democrats feared.
""The only person who had a worse night than President Obama was Sesame Street's
Big Bird.""
During the debate, when asked what federal spending he would cut, Romney
targeted the Public Broadcasting Service, home to the children's show ""Sesame
Street."" He expressed love for the show's large, feathery central character.
Then he followed with a nod to the debate's moderator, Mr. Lehrer of PBS's
""Newshour,"" another icon of public TV.
""I actually like you too,"" Romney said.
The quip seemed prepackaged, but no matter. It was a light moment in a fairly
dry debate, and for a candidate who has struggled with likability, it was one of
many reasons Republicans have a spring in their step Thursday morning.
",Presidential debate: Mitt Romney injects new life in his campaign;,0.015873015873015872,"['offens', 'crack', 'hit', 'cut', 'beat', 'knock', 'knock', 'cut', 'struggl']",1004,2012
