,_id,candidate_ratio,canditate_ratio,days_after,debate,newspaper,stemmed,text,title,violent_ratio,violent_words,word_count,year
47,281,0.0686164229471316,0.07536557930258718,1,3,The Washington Post,"['boca', 'raton', 'fla', 'presid', 'obama', 'mitt', 'romney', 'clash', 'repeat', 'foreign', 'polici', 'monday', 'night', 'presid', 'argu', 'assert', 'romney', 'lack', 'consist', 'clariti', 'vision', 'lead', 'countri', 'republican', 'nomine', 'charg', 'obama', 'weak', 'ineffect', 'face', 'grow', 'turmoil', 'world', 'two', 'candid', 'differ', 'sharpli', 'presid', 'handl', 'upris', 'middl', 'east', 'effort', 'prevent', 'iran', 'obtain', 'nuclear', 'weapon', 'treatment', 'israel', 'often', 'seem', 'find', 'common', 'ground', 'polici', 'administr', 'pursu', 'debat', 'candid', 'campaign', 'begin', 'twoweek', 'sprint', 'elect', 'day', 'campaign', 'focus', 'relat', 'hand', 'state', 'two', 'object', 'win', 'remain', 'undecid', 'voter', 'last', 'barrag', 'televis', 'ad', 'intensifi', 'effort', 'get', 'support', 'poll', 'either', 'earlyvot', 'period', 'nov', 'focus', 'last', 'three', 'debat', 'suppos', 'foreign', 'polici', 'romney', 'obama', 'use', 'time', 'talk', 'issu', 'import', 'voter', 'job', 'economi', 'budget', 'talk', 'auto', 'bailout', 'school', 'class', 'size', 'romney', 'tax', 'plan', 'sever', 'point', 'cbss', 'bob', 'schieffer', 'serv', 'moder', 'tri', 'bring', 'back', 'foreign', 'affair', 'nation', 'secur', 'sometim', 'avail', 'romney', 'appear', 'cautious', 'especi', 'earli', 'stage', 'debat', 'grew', 'assert', 'even', 'went', 'throughout', 'debat', 'obama', 'seem', 'eager', 'readi', 'take', 'fight', 'oppon', 'use', 'experi', 'draw', 'contrast', 'challeng', 'time', 'romney', 'offer', 'point', 'critic', 'polici', 'obama', 'glare', 'direct', 'romney', 'central', 'critiqu', 'presid', 'weak', 'face', 'rise', 'tide', 'chao', 'tumult', 'world', 'obama', 'charg', 'romney', 'map', 'polici', 'challeng', 'respond', 'say', 'attack', 'talk', 'go', 'deal', 'challeng', 'exist', 'middl', 'east', 'obama', 'press', 'case', 'romney', 'worldview', 'well', 'prescript', 'domest', 'front', 'wrong', 'also', 'root', 'past', 'come', 'foreign', 'polici', 'seem', 'want', 'import', 'foreign', 'polici', 'like', 'social', 'polici', 'econom', 'polici', 'said', 'although', 'two', 'laid', 'differ', 'romney', 'less', 'assert', 'make', 'distinct', 'presid', 'robust', 'foreign', 'polici', 'speech', 'along', 'campaign', 'trail', 'final', 'debat', 'conclud', 'grip', 'seri', 'encount', 'two', 'candid', 'shook', 'campaign', 'dramat', 'recent', 'debat', 'romney', 'use', 'first', 'faceoff', 'greatest', 'advantag', 'aggress', 'perform', 'contrast', 'lacklust', 'even', 'presid', 'obama', 'rebound', 'second', 'debat', 'mark', 'sharp', 'testi', 'exchang', 'candid', 'much', 'revers', 'gain', 'romney', 'made', 'threeweek', 'period', 'includ', 'debat', 'vice', 'presid', 'biden', 'romney', 'run', 'mate', 'rep', 'paul', 'ryan', 'wis', 'began', 'obama', 'hold', 'small', 'lead', 'nation', 'bigger', 'lead', 'battleground', 'state', 'debat', 'season', 'end', 'monday', 'nation', 'poll', 'show', 'dead', 'heat', 'battleground', 'increas', 'tight', 'new', 'washington', 'postabc', 'news', 'poll', 'start', 'daili', 'track', 'race', 'final', 'two', 'week', 'show', 'obama', 'percent', 'romney', 'percent', 'two', 'week', 'ago', 'postabc', 'poll', 'obama', 'percent', 'romney', 'percent', 'obama', 'romney', 'touch', 'mani', 'major', 'area', 'tension', 'world', 'civil', 'war', 'syria', 'kill', 'four', 'american', 'libya', 'discuss', 'war', 'afghanistan', 'rise', 'china', 'iran', 'israel', 'differ', 'agreement', 'came', 'clear', 'campaign', 'trail', 'romney', 'focus', 'much', 'critic', 'obama', 'middl', 'east', 'polici', 'handl', 'iran', 'nuclear', 'weapon', 'program', 'warn', 'repeat', 'tehran', 'move', 'four', 'year', 'closer', 'goal', 'presid', 'tough', 'enough', 'deter', 'contend', 'obama', 'apolog', 'tour', 'muslim', 'countri', 'first', 'year', 'offic', 'includ', 'stop', 'israel', 'signal', 'sign', 'american', 'weak', 'presid', 'action', 'sent', 'messag', 'iranian', 'mullah', 'hey', 'know', 'keep', 'push', 'along', 'keep', 'talk', 'go', 'go', 'keep', 'spin', 'centrifug', 'romney', 'said', 'centrifug', 'spin', 'uranium', 'prepar', 'creat', 'nuclear', 'threat', 'unit', 'state', 'world', 'romney', 'use', 'argument', 'appeal', 'jewish', 'voter', 'especi', 'florida', 'critic', 'white', 'hous', 'postur', 'toward', 'israel', 'nation', 'secur', 'obama', 'sensit', 'critiqu', 'appear', 'anticip', 'line', 'attack', 'refer', 'proactiv', 'commit', 'israel', 'defens', 'romney', 'point', 'presid', 'stop', 'israel', 'offic', 'obama', 'quick', 'shot', 'back', 'note', 'visit', 'countri', 'candid', 'four', 'year', 'ago', 'take', 'donor', 'attend', 'fundrais', 'remark', 'rebuk', 'romney', 'trip', 'israel', 'summer', 'includ', 'time', 'rais', 'money', 'campaign', 'obama', 'point', 'trip', 'visit', 'holocaust', 'memori', 'yad', 'vashem', 'remind', 'natur', 'evil', 'bond', 'israel', 'unbreak', 'call', 'notion', 'apolog', 'tour', 'biggest', 'whopper', 'told', 'campaign', 'season', 'discount', 'factcheck', 'report', 'israel', 'attack', 'america', 'stand', 'israel', 'obama', 'pledg', 'although', 'two', 'argu', 'last', 'week', 'debat', 'happen', 'diplomat', 'compound', 'libya', 'whether', 'administr', 'slow', 'identifi', 'attack', 'act', 'terror', 'issu', 'never', 'got', 'full', 'air', 'monday', 'one', 'point', 'romney', 'argu', 'would', 'support', 'budget', 'cut', 'militari', 'point', 'navi', 'reduc', 'fleet', 'warship', 'lowest', 'number', 'sinc', 'earli', 'well', 'governor', 'also', 'fewer', 'hors', 'bayonet', 'presid', 'counter', 'natur', 'militari', 'chang', 'thing', 'call', 'aircraft', 'carrier', 'plane', 'land', 'ship', 'underwat', 'nuclear', 'submarin', 'competit', 'race', 'two', 'week', 'remain', 'underscor', 'new', 'postabc', 'news', 'survey', 'show', 'statist', 'tie', 'sign', 'romney', 'run', 'even', 'obama', 'swing', 'state', 'behind', 'number', 'sizabl', 'gender', 'gap', 'larg', 'postabc', 'nation', 'poll', 'campaign', 'femal', 'voter', 'break', 'percent', 'presid', 'men', 'percent', 'romney', 'white', 'voter', 'side', 'romney', 'point', 'margin', 'percent', 'nonwhit', 'break', 'heavili', 'presid', 'percent', 'among', 'african', 'american', 'margin', 'overwhelm', 'percent', 'seesaw', 'battl', 'voter', 'obama', 'edg', 'enthusiasm', 'percent', 'backer', 'say', 'enthusiast', 'candidaci', 'higher', 'percent', 'romney', 'engag', 'run', 'still', 'obama', 'popular', 'trail', 'level', 'new', 'poll', 'also', 'show', 'two', 'candid', 'pariti', 'basic', 'test', 'number', 'posit', 'view', 'obama', 'percent', 'howev', 'presid', 'maintain', 'edg', 'strong', 'favor', 'rate', 'obama', 'campaignhigh', 'point', 'edg', 'romney', 'handl', 'tax', 'point', 'lead', 'medicar', 'point', 'advantag', 'women', 'issu', 'sevenpoint', 'edg', 'come', 'understand', 'econom', 'problem', 'peopl', 'still', 'wide', 'view', 'help', 'middl', 'class', 'wealthi', 'opposit', 'voter', 'see', 'romney', 'advanc', 'monday', 'debat', 'poll', 'show', 'romney', 'rival', 'obama', 'come', 'deal', 'intern', 'affair', 'terror', 'romney', 'also', 'run', 'even', 'presid', 'voter', 'pick', 'better', 'command', 'chief', 'obama', 'spent', 'weekend', 'camp', 'david', 'prepar', 'final', 'debat', 'arriv', 'florida', 'monday', 'afternoon', 'tuesday', 'begin', 'crosscountri', 'blitz', 'take', 'almost', 'everi', 'import', 'battleground', 'state', 'reflect', 'limit', 'time', 'left', 'elect', 'day', 'tighten', 'poll', 'nation', 'battleground', 'bill', 'campaign', 'twoday', 'nonstop', 'america', 'forward', 'tour', 'obama', 'schedul', 'barnstorm', 'ohio', 'florida', 'virginia', 'iowa', 'colorado', 'nevada', 'also', 'make', 'detour', 'wednesday', 'california', 'consid', 'safe', 'column', 'appear', 'nbc', 'tonight', 'show', 'jay', 'leno', 'romney', 'prepar', 'extens', 'foreign', 'polici', 'debat', 'come', 'campaign', 'trail', 'saturday', 'three', 'day', 'prep', 'session', 'waterfront', 'hotel', 'nearbi', 'delray', 'beach', 'fla', 'top', 'polit', 'polici', 'advis', 'sen', 'rob', 'portman', 'ohio', 'play', 'obama', 'mock', 'debat', 'becom', 'increas', 'influenti', 'advis', 'nomine', 'tuesday', 'romney', 'head', 'west', 'reunit', 'ryan', 'stage', 'joint', 'ralli', 'nevada', 'colorado', 'romney', 'campaign', 'iowa', 'allimport', 'ohio', 'advis', 'said', 'romney', 'start', 'deliv', 'close', 'argument', 'voter', 'week', 'consid', 'make', 'major', 'speech', 'debt', 'govern', 'spend', 'come', 'day', 'balzd', 'washpostcom', 'nakamurad', 'washpostcom', 'jerri', 'markon', 'philip', 'rucker', 'contribut', 'report']","﻿
BOCA RATON, Fla. - President Obama and Mitt Romney clashed repeatedly over
foreign policy here Monday night, with the president arguing assertively that
Romney lacks the consistency or clarity of vision to lead the country while the
Republican nominee charged that Obama has been weak and ineffective in the face
of growing turmoil in the world.
The two candidates differed most sharply over the president's handling of the
uprisings in the Middle East, his efforts to prevent Iran from obtaining nuclear
weapons and his treatment of Israel. But often they seemed to find common ground
on some of the policies the administration is pursuing.
With the debates now over, the candidates and their campaigns begin a two-week
sprint to Election Day. The campaigns will be focused on a relative handful of
states, with two objectives: winning over the few remaining undecided voters
with a last barrage of television ads and intensifying efforts to get their
supporters to the polls - either during early-voting periods or on Nov. .
The focus of the last of their three debates was supposed to be foreign policy,
but both Romney and Obama used their time to talk about the issues most
important to voters: jobs, the economy and the budget. They talked about the
auto bailout, school class sizes and Romney's tax plan. At several points, CBS's
Bob Schieffer, who served as moderator, tried to bring them back to foreign
affairs and national security, but sometimes to no avail.
Romney appeared cautious, especially during the early stages of the debate, but
grew more assertive as the evening went on. Throughout the debate, Obama seemed
eager and ready to take the fight to his opponent, using his experience to draw
contrasts with the challenger. At times, as Romney offered pointed criticism of
his policies, Obama glared directly at him.
Romney's central critique was that the president has been weak in the face of ""a
rising tide of chaos"" and tumult in the world. When Obama charged that Romney
has been ""all over the map"" in his policies, the challenger responded by saying,
""Attacking me is not talking about how we're going to deal with the challenges
that exist in the Middle East.""
But Obama pressed his case that Romney's worldview as well as his prescriptions
for the domestic front are not just wrong but also rooted in the past. ""When it
comes to our foreign policy, you seem to want to import the foreign policies of
the s, just like the social policies of the s and the economic policies
of the s,"" he said.
Although the two laid out some differences, Romney was less assertive in making
distinctions with the president than he has been in some of his more robust
foreign policy speeches along the campaign trail.
The final debate concluded a gripping series of encounters between the two
candidates that shook up the campaign as dramatically as any recent debates.
Romney used the first faceoff to greatest advantage with an aggressive
performance that contrasted with a lackluster evening for the president. Obama
rebounded in the second debate, which was marked by sharp and testy exchanges
between the candidates, but not so much as to reverse the gains Romney had made.
The three-week period, which included a debate between Vice President Biden and
Romney's running mate, Rep. Paul Ryan (Wis.), began with Obama holding a small
lead nationally and a bigger lead in some of the battleground states. The debate
season ended Monday with national polls showing a dead heat and the
battlegrounds increasingly tight.
A new Washington Post-ABC News poll, the start of what will be daily tracking of
the race over the final two weeks, showed Obama at  percent and Romney at 
percent. Two weeks ago, the Post-ABC poll had Obama at  percent and Romney at
 percent.
Obama and Romney touched on many of the major areas of tension in the world,
from the civil war in Syria to the killings of four Americans in Libya. They
discussed the war in Afghanistan and the rise of China. But it was on Iran and
Israel where their differences and agreements came through most clearly.
As he has on the campaign trail, Romney focused much of his criticism of Obama's
Middle East policy on his handling of Iran's nuclear weapons program, warning
repeatedly that Tehran has moved ""four years closer"" to its goal because the
president has not been tough enough to deter it.
He contended that Obama's ""apology tour"" of Muslim countries during his first
year in office, which did not include a stop in Israel, signaled a sign of
American weakness.
The president's actions sent a message to the Iranian mullahs ""that, hey, you
know, we can keep on pushing along here. We can keep talks going on, but we're
just going to keep on spinning centrifuges,"" Romney said. ""Now there are some
, centrifuges spinning uranium, preparing to create a nuclear threat to the
United States and to the world.""
Romney has used the argument to appeal to Jewish voters, especially here in
Florida, who have been critical of the White House's posture toward Israel's
national security. But Obama, sensitive to the critique, appeared to anticipate
the line of attack, referring proactively to his commitment to Israel's defense.
After Romney pointed out that the president had not stopped in Israel while in
office, Obama quickly shot back, noting that he had visited the country as a
candidate four years ago and ""did not take donors and did not attend
fundraisers."" The remark was a rebuke of Romney's trip to Israel this summer,
which included time raising money for his campaign.
Obama pointed out that during his trip in , he visited Holocaust memorial
Yad Vashem to ""remind myself of the nature of evil and why our bond with Israel
will be unbreakable.""
And he called the notion of an ""apology tour"" the ""biggest whopper"" told during
the campaign season, having been discounted by ""fact-checkers and reporters.""
""If Israel is attacked, America will stand with Israel,"" Obama pledged.
Although the two had argued at last week's debate about what happened at a U.S.
diplomatic compound in Libya and whether the administration had been slow to
identify the attack as an act of terrorism, the issue never got a full airing on
Monday.
At one point, Romney argued that he would not support budget cuts to the
military, pointing out that the Navy has reduced its fleet of warships to the
lowest number since the early s.
""Well, Governor, we also have fewer horses and bayonets,"" the president
countered, ""because the nature of our military's changed. We have these things
called aircraft carriers where planes land on them. We have these ships that go
underwater, nuclear submarines.""
The competitiveness of the race with just two weeks remaining was underscored by
the new Post-ABC News survey showing a statistical tie and signs that Romney is
now running even with Obama in the swing states.
Behind those numbers is a sizable gender gap - as large as it has been in
Post-ABC national polling during this campaign. Female voters break  to 
percent for the president; men go  to  percent for Romney.
White voters side with Romney by a -point margin ( to  percent), while
non-whites break heavily for the president,  to  percent. Among African
Americans, the margin is overwhelming:  to  percent.
The seesawing battle for voters now has Obama with the edge on enthusiasm: 
percent of his backers say they are ""very enthusiastic"" about his candidacy,
higher than the  percent of Romney's who are that engaged with his run. Still,
Obama's popularity trails his  levels.
The new poll also showed the two candidates at parity in a basic test of
with the number with positive views of Obama ( to  percent). However, the
president maintains the edge in ""strongly favorable"" ratings.
Obama has a campaign-high -point edge over Romney on handling taxes, a
-point lead on Medicare and a -point advantage on ""women's issues."" He has a
seven-point edge when it comes to understanding the economic problems people are
having and is still widely viewed as doing more to help the middle class than
the wealthy, the opposite of how voters see Romney.
In advance of Monday's debate, the poll showed Romney now rivaling Obama when it
comes to dealing with international affairs and terrorism. Romney also runs
about evenly with the president as voters' pick for who is the better commander
in chief.
Obama spent the weekend at Camp David preparing for the final debate, arriving
in Florida on Monday afternoon. On Tuesday, he will begin a cross-country blitz
that will take him to almost every important battleground state, a reflection
both of the limited time left before Election Day and the tightening polls, both
nationally and in the battlegrounds.
Billed by the campaign as a two-day, nonstop ""America Forward tour,'' Obama is
scheduled to barnstorm through Ohio, Florida, Virginia, Iowa, Colorado and
Nevada. He will also make a detour on Wednesday to California, which is
considered safely in his column, for an appearance on NBC's ""The Tonight Show
With Jay Leno.""
Romney prepared extensively for the foreign policy debate, coming off the
campaign trail on Saturday for three days of prep sessions at a waterfront hotel
in nearby Delray Beach, Fla.
His top political and policy advisers were with him, as was Sen. Rob Portman of
Ohio, who played Obama in the mock debates and has become an increasingly
influential adviser to the nominee.
On Tuesday, Romney heads west to reunite with Ryan, staging joint rallies in
Nevada and Colorado; from there, Romney will campaign in Iowa and all-important
Ohio. Advisers said Romney will start delivering his closing argument to voters
this week, and he is considering making a major speech on debt and government
spending in the coming days.
balzd@washpost.com
nakamurad@washpost.com
Jerry Markon and Philip Rucker contributed to this report.
",No Title,0.01799775028121485,"['clash', 'charg', 'fight', 'charg', 'attack', 'aggress', 'hold', 'attack', 'defens', 'attack', 'attack', 'cut', 'bayonet', 'break', 'break', 'battl']",1659,2012
